________________________________
        bugs -> ot-mag.icmm.ru ETHER Type=0800 (IP), size = 1434 bytes
        bugs -> ot-mag.icmm.ru IP  D=195.69.157.34 S=195.69.156.67 LEN=1420, ID=60196, TOS=0x0, TTL=64
        bugs -> ot-mag.icmm.ru TCP D=4076 S=52661 Ack=2924641840 Seq=1209200132 Len=1368 Win=49248 Options=<nop,nop,tstamp 601952010 13829257>
________________________________
        bugs -> ot-mag.icmm.ru ETHER Type=0800 (IP), size = 1434 bytes
        bugs -> ot-mag.icmm.ru IP  D=195.69.157.34 S=195.69.156.67 LEN=1420, ID=60197, TOS=0x0, TTL=64
        bugs -> ot-mag.icmm.ru TCP D=4076 S=52661 Ack=2924641840 Seq=1209201500 Len=1368 Win=49248 Options=<nop,nop,tstamp 601952010 13829257>
________________________________
        bugs -> ot-mag.icmm.ru ETHER Type=0800 (IP), size = 1434 bytes
        bugs -> ot-mag.icmm.ru IP  D=195.69.157.34 S=195.69.156.67 LEN=1420, ID=60198, TOS=0x0, TTL=64
        bugs -> ot-mag.icmm.ru TCP D=4076 S=52661 Push Ack=2924641840 Seq=1209202868 Len=1368 Win=49248 Options=<nop,nop,tstamp 601952010 13829257>
________________________________
ot-mag.icmm.ru -> bugs         ETHER Type=0800 (IP), size = 66 bytes
ot-mag.icmm.ru -> bugs         IP  D=195.69.156.67 S=195.69.157.34 LEN=52, ID=55444, TOS=0x0, TTL=127
ot-mag.icmm.ru -> bugs         TCP D=52661 S=4076 Ack=1209178308 Seq=2924641840 Len=0 Win=25928 Options=<nop,nop,tstamp 13829257 601952009>
________________________________
ot-mag.icmm.ru -> bugs         ETHER Type=0800 (IP), size = 66 bytes
ot-mag.icmm.ru -> bugs         IP  D=195.69.156.67 S=195.69.157.34 LEN=52, ID=55445, TOS=0x0, TTL=127
ot-mag.icmm.ru -> bugs         TCP D=52661 S=4076 Ack=1209181012 Seq=2924641840 Len=0 Win=23224 Options=<nop,nop,tstamp 13829257 601952009>
________________________________
ot-mag.icmm.ru -> bugs         ETHER Type=0800 (IP), size = 66 bytes
ot-mag.icmm.ru -> bugs         IP  D=195.69.156.67 S=195.69.157.34 LEN=52, ID=55446, TOS=0x0, TTL=127
ot-mag.icmm.ru -> bugs         TCP D=52661 S=4076 Ack=1209183748 Seq=2924641840 Len=0 Win=20488 Options=<nop,nop,tstamp 13829257 601952009>
________________________________
ot-mag.icmm.ru -> bugs         ETHER Type=0800 (IP), size = 66 bytes
ot-mag.icmm.ru -> bugs         IP  D=195.69.156.67 S=195.69.157.34 LEN=52, ID=55447, TOS=0x0, TTL=127
ot-mag.icmm.ru -> bugs         TCP D=52661 S=4076 Ack=1209186484 Seq=2924641840 Len=0 Win=17752 Options=<nop,nop,tstamp 13829257 601952009>
________________________________
ot-mag.icmm.ru -> bugs         ETHER Type=0800 (IP), size = 66 bytes
ot-mag.icmm.ru -> bugs         IP  D=195.69.156.67 S=195.69.157.34 LEN=52, ID=55448, TOS=0x0, TTL=127
ot-mag.icmm.ru -> bugs         TCP D=52661 S=4076 Ack=1209189220 Seq=2924641840 Len=0 Win=19752 Options=<nop,nop,tstamp 13829257 601952009>
________________________________
ot-mag.icmm.ru -> bugs         ETHER Type=0800 (IP), size = 66 bytes
ot-mag.icmm.ru -> bugs         IP  D=195.69.156.67 S=195.69.157.34 LEN=52, ID=55449, TOS=0x0, TTL=127
ot-mag.icmm.ru -> bugs         TCP D=52661 S=4076 Ack=1209190588 Seq=2924641840 Len=0 Win=31400 Options=<nop,nop,tstamp 13829257 601952009>
________________________________
ot-mag.icmm.ru -> bugs         ETHER Type=0800 (IP), size = 66 bytes
ot-mag.icmm.ru -> bugs         IP  D=195.69.156.67 S=195.69.157.34 LEN=52, ID=55450, TOS=0x0, TTL=127
ot-mag.icmm.ru -> bugs         TCP D=52661 S=4076 Ack=1209193324 Seq=2924641840 Len=0 Win=28664 Options=<nop,nop,tstamp 13829257 601952009>
________________________________
ot-mag.icmm.ru -> bugs         ETHER Type=0800 (IP), size = 66 bytes
ot-mag.icmm.ru -> bugs         IP  D=195.69.156.67 S=195.69.157.34 LEN=52, ID=55451, TOS=0x0, TTL=127
ot-mag.icmm.ru -> bugs         TCP D=52661 S=4076 Ack=1209194692 Seq=2924641840 Len=0 Win=31032 Options=<nop,nop,tstamp 13829257 601952009>
________________________________
ot-mag.icmm.ru -> bugs         ETHER Type=0800 (IP), size = 66 bytes
ot-mag.icmm.ru -> bugs         IP  D=195.69.156.67 S=195.69.157.34 LEN=52, ID=55452, TOS=0x0, TTL=127
ot-mag.icmm.ru -> bugs         TCP D=52661 S=4076 Ack=1209196060 Seq=2924641840 Len=0 Win=32768 Options=<nop,nop,tstamp 13829257 601952009>
________________________________
        bugs -> ot-mag.icmm.ru ETHER Type=0800 (IP), size = 1434 bytes
        bugs -> ot-mag.icmm.ru IP  D=195.69.157.34 S=195.69.156.67 LEN=1420, ID=60199, TOS=0x0, TTL=64
        bugs -> ot-mag.icmm.ru TCP D=4076 S=52661 Ack=2924641840 Seq=1209204236 Len=1368 Win=49248 Options=<nop,nop,tstamp 601952010 13829257>
________________________________
        bugs -> ot-mag.icmm.ru ETHER Type=0800 (IP), size = 1434 bytes
        bugs -> ot-mag.icmm.ru IP  D=195.69.157.34 S=195.69.156.67 LEN=1420, ID=60200, TOS=0x0, TTL=64
        bugs -> ot-mag.icmm.ru TCP D=4076 S=52661 Ack=2924641840 Seq=1209205604 Len=1368 Win=49248 Options=<nop,nop,tstamp 601952010 13829257>
________________________________
        bugs -> ot-mag.icmm.ru ETHER Type=0800 (IP), size = 1434 bytes
        bugs -> ot-mag.icmm.ru IP  D=195.69.157.34 S=195.69.156.67 LEN=1420, ID=60201, TOS=0x0, TTL=64
        bugs -> ot-mag.icmm.ru TCP D=4076 S=52661 Ack=2924641840 Seq=1209206972 Len=1368 Win=49248 Options=<nop,nop,tstamp 601952010 13829257>
________________________________
        bugs -> ot-mag.icmm.ru ETHER Type=0800 (IP), size = 1434 bytes
        bugs -> ot-mag.icmm.ru IP  D=195.69.157.34 S=195.69.156.67 LEN=1420, ID=60202, TOS=0x0, TTL=64
        bugs -> ot-mag.icmm.ru TCP D=4076 S=52661 Ack=2924641840 Seq=1209208340 Len=1368 Win=49248 Options=<nop,nop,tstamp 601952010 13829257>
________________________________
        bugs -> ot-mag.icmm.ru ETHER Type=0800 (IP), size = 1434 bytes
        bugs -> ot-mag.icmm.ru IP  D=195.69.157.34 S=195.69.156.67 LEN=1420, ID=60203, TOS=0x0, TTL=64
        bugs -> ot-mag.icmm.ru TCP D=4076 S=52661 Ack=2924641840 Seq=1209209708 Len=1368 Win=49248 Options=<nop,nop,tstamp 601952010 13829257>
________________________________
        bugs -> ot-mag.icmm.ru ETHER Type=0800 (IP), size = 1434 bytes
        bugs -> ot-mag.icmm.ru IP  D=195.69.157.34 S=195.69.156.67 LEN=1420, ID=60204, TOS=0x0, TTL=64
        bugs -> ot-mag.icmm.ru TCP D=4076 S=52661 Ack=2924641840 Seq=1209211076 Len=1368 Win=49248 Options=<nop,nop,tstamp 601952010 13829257>
________________________________
        bugs -> ot-mag.icmm.ru ETHER Type=0800 (IP), size = 1402 bytes
        bugs -> ot-mag.icmm.ru IP  D=195.69.157.34 S=195.69.156.67 LEN=1388, ID=60205, TOS=0x0, TTL=64
        bugs -> ot-mag.icmm.ru TCP D=4076 S=52661 Ack=2924641840 Seq=1209212444 Len=1336 Win=49248 Options=<nop,nop,tstamp 601952010 13829257>
________________________________
        bugs -> ot-mag.icmm.ru ETHER Type=0800 (IP), size = 1434 bytes
        bugs -> ot-mag.icmm.ru IP  D=195.69.157.34 S=195.69.156.67 LEN=1420, ID=60206, TOS=0x0, TTL=64
        bugs -> ot-mag.icmm.ru TCP D=4076 S=52661 Ack=2924641840 Seq=1209213780 Len=1368 Win=49248 Options=<nop,nop,tstamp 601952010 13829257>
________________________________
        bugs -> ot-mag.icmm.ru ETHER Type=0800 (IP), size = 1434 bytes
        bugs -> ot-mag.icmm.ru IP  D=195.69.157.34 S=195.69.156.67 LEN=1420, ID=60207, TOS=0x0, TTL=64
        bugs -> ot-mag.icmm.ru TCP D=4076 S=52661 Ack=2924641840 Seq=1209215148 Len=1368 Win=49248 Options=<nop,nop,tstamp 601952010 13829257>
________________________________
        bugs -> ot-mag.icmm.ru ETHER Type=0800 (IP), size = 1434 bytes
        bugs -> ot-mag.icmm.ru IP  D=195.69.157.34 S=195.69.156.67 LEN=1420, ID=60208, TOS=0x0, TTL=64
        bugs -> ot-mag.icmm.ru TCP D=4076 S=52661 Ack=2924641840 Seq=1209216516 Len=1368 Win=49248 Options=<nop,nop,tstamp 601952010 13829257>
________________________________
        bugs -> ot-mag.icmm.ru ETHER Type=0800 (IP), size = 1434 bytes
        bugs -> ot-mag.icmm.ru IP  D=195.69.157.34 S=195.69.156.67 LEN=1420, ID=60209, TOS=0x0, TTL=64
        bugs -> ot-mag.icmm.ru TCP D=4076 S=52661 Ack=2924641840 Seq=1209217884 Len=1368 Win=49248 Options=<nop,nop,tstamp 601952010 13829257>
________________________________
        bugs -> ot-mag.icmm.ru ETHER Type=0800 (IP), size = 1434 bytes
        bugs -> ot-mag.icmm.ru IP  D=195.69.157.34 S=195.69.156.67 LEN=1420, ID=60210, TOS=0x0, TTL=64
        bugs -> ot-mag.icmm.ru TCP D=4076 S=52661 Ack=2924641840 Seq=1209219252 Len=1368 Win=49248 Options=<nop,nop,tstamp 601952010 13829257>
________________________________
        bugs -> ot-mag.icmm.ru ETHER Type=0800 (IP), size = 1434 bytes
        bugs -> ot-mag.icmm.ru IP  D=195.69.157.34 S=195.69.156.67 LEN=1420, ID=60211, TOS=0x0, TTL=64
        bugs -> ot-mag.icmm.ru TCP D=4076 S=52661 Push Ack=2924641840 Seq=1209220620 Len=1368 Win=49248 Options=<nop,nop,tstamp 601952010 13829257>
________________________________
        bugs -> ot-mag.icmm.ru ETHER Type=0800 (IP), size = 1434 bytes
        bugs -> ot-mag.icmm.ru IP  D=195.69.157.34 S=195.69.156.67 LEN=1420, ID=60212, TOS=0x0, TTL=64
        bugs -> ot-mag.icmm.ru TCP D=4076 S=52661 Ack=2924641840 Seq=1209221988 Len=1368 Win=49248 Options=<nop,nop,tstamp 601952010 13829257>
________________________________
        bugs -> ot-mag.icmm.ru ETHER Type=0800 (IP), size = 1434 bytes
        bugs -> ot-mag.icmm.ru IP  D=195.69.157.34 S=195.69.156.67 LEN=1420, ID=60213, TOS=0x0, TTL=64
        bugs -> ot-mag.icmm.ru TCP D=4076 S=52661 Ack=2924641840 Seq=1209223356 Len=1368 Win=49248 Options=<nop,nop,tstamp 601952010 13829257>
________________________________
        bugs -> ot-mag.icmm.ru ETHER Type=0800 (IP), size = 1434 bytes
        bugs -> ot-mag.icmm.ru IP  D=195.69.157.34 S=195.69.156.67 LEN=1420, ID=60214, TOS=0x0, TTL=64
        bugs -> ot-mag.icmm.ru TCP D=4076 S=52661 Ack=2924641840 Seq=1209224724 Len=1368 Win=49248 Options=<nop,nop,tstamp 601952010 13829257>
________________________________
        bugs -> ot-mag.icmm.ru ETHER Type=0800 (IP), size = 1434 bytes
        bugs -> ot-mag.icmm.ru IP  D=195.69.157.34 S=195.69.156.67 LEN=1420, ID=60215, TOS=0x0, TTL=64
        bugs -> ot-mag.icmm.ru TCP D=4076 S=52661 Ack=2924641840 Seq=1209226092 Len=1368 Win=49248 Options=<nop,nop,tstamp 601952010 13829257>
________________________________
        bugs -> ot-mag.icmm.ru ETHER Type=0800 (IP), size = 1434 bytes
        bugs -> ot-mag.icmm.ru IP  D=195.69.157.34 S=195.69.156.67 LEN=1420, ID=60216, TOS=0x0, TTL=64
        bugs -> ot-mag.icmm.ru TCP D=4076 S=52661 Push Ack=2924641840 Seq=1209227460 Len=1368 Win=49248 Options=<nop,nop,tstamp 601952010 13829257>
________________________________
ot-mag.icmm.ru -> bugs         ETHER Type=0800 (IP), size = 66 bytes
ot-mag.icmm.ru -> bugs         IP  D=195.69.156.67 S=195.69.157.34 LEN=52, ID=55453, TOS=0x0, TTL=127
ot-mag.icmm.ru -> bugs         TCP D=52661 S=4076 Ack=1209198764 Seq=2924641840 Len=0 Win=32768 Options=<nop,nop,tstamp 13829257 601952010>
________________________________
ot-mag.icmm.ru -> bugs         ETHER Type=0800 (IP), size = 66 bytes
ot-mag.icmm.ru -> bugs         IP  D=195.69.156.67 S=195.69.157.34 LEN=52, ID=55454, TOS=0x0, TTL=127
ot-mag.icmm.ru -> bugs         TCP D=52661 S=4076 Ack=1209201500 Seq=2924641840 Len=0 Win=32768 Options=<nop,nop,tstamp 13829257 601952010>
________________________________
        bugs -> ot-mag.icmm.ru ETHER Type=0800 (IP), size = 1402 bytes
        bugs -> ot-mag.icmm.ru IP  D=195.69.157.34 S=195.69.156.67 LEN=1388, ID=60217, TOS=0x0, TTL=64
        bugs -> ot-mag.icmm.ru TCP D=4076 S=52661 Ack=2924641840 Seq=1209228828 Len=1336 Win=49248 Options=<nop,nop,tstamp 601952010 13829257>
________________________________
        bugs -> ot-mag.icmm.ru ETHER Type=0800 (IP), size = 1434 bytes
        bugs -> ot-mag.icmm.ru IP  D=195.69.157.34 S=195.69.156.67 LEN=1420, ID=60218, TOS=0x0, TTL=64
        bugs -> ot-mag.icmm.ru TCP D=4076 S=52661 Push Ack=2924641840 Seq=1209230164 Len=1368 Win=49248 Options=<nop,nop,tstamp 601952010 13829257>
________________________________
        bugs -> ot-mag.icmm.ru ETHER Type=0800 (IP), size = 1434 bytes
        bugs -> ot-mag.icmm.ru IP  D=195.69.157.34 S=195.69.156.67 LEN=1420, ID=60219, TOS=0x0, TTL=64
        bugs -> ot-mag.icmm.ru TCP D=4076 S=52661 Ack=2924641840 Seq=1209231532 Len=1368 Win=49248 Options=<nop,nop,tstamp 601952010 13829257>
________________________________
        bugs -> ot-mag.icmm.ru ETHER Type=0800 (IP), size = 1434 bytes
        bugs -> ot-mag.icmm.ru IP  D=195.69.157.34 S=195.69.156.67 LEN=1420, ID=60220, TOS=0x0, TTL=64
        bugs -> ot-mag.icmm.ru TCP D=4076 S=52661 Push Ack=2924641840 Seq=1209232900 Len=1368 Win=49248 Options=<nop,nop,tstamp 601952010 13829257>
________________________________
ot-mag.icmm.ru -> bugs         ETHER Type=0800 (IP), size = 66 bytes
ot-mag.icmm.ru -> bugs         IP  D=195.69.156.67 S=195.69.157.34 LEN=52, ID=55455, TOS=0x0, TTL=127
ot-mag.icmm.ru -> bugs         TCP D=52661 S=4076 Ack=1209204236 Seq=2924641840 Len=0 Win=32768 Options=<nop,nop,tstamp 13829257 601952010>
________________________________
        bugs -> ot-mag.icmm.ru ETHER Type=0800 (IP), size = 1434 bytes
        bugs -> ot-mag.icmm.ru IP  D=195.69.157.34 S=195.69.156.67 LEN=1420, ID=60221, TOS=0x0, TTL=64
        bugs -> ot-mag.icmm.ru TCP D=4076 S=52661 Ack=2924641840 Seq=1209234268 Len=1368 Win=49248 Options=<nop,nop,tstamp 601952010 13829257>
________________________________
        bugs -> ot-mag.icmm.ru ETHER Type=0800 (IP), size = 1434 bytes
        bugs -> ot-mag.icmm.ru IP  D=195.69.157.34 S=195.69.156.67 LEN=1420, ID=60222, TOS=0x0, TTL=64
        bugs -> ot-mag.icmm.ru TCP D=4076 S=52661 Push Ack=2924641840 Seq=1209235636 Len=1368 Win=49248 Options=<nop,nop,tstamp 601952010 13829257>
________________________________
ot-mag.icmm.ru -> bugs         ETHER Type=0800 (IP), size = 66 bytes
ot-mag.icmm.ru -> bugs         IP  D=195.69.156.67 S=195.69.157.34 LEN=52, ID=55456, TOS=0x0, TTL=127
ot-mag.icmm.ru -> bugs         TCP D=52661 S=4076 Ack=1209206972 Seq=2924641840 Len=0 Win=32768 Options=<nop,nop,tstamp 13829257 601952010>
________________________________
        bugs -> ot-mag.icmm.ru ETHER Type=0800 (IP), size = 1434 bytes
        bugs -> ot-mag.icmm.ru IP  D=195.69.157.34 S=195.69.156.67 LEN=1420, ID=60223, TOS=0x0, TTL=64
        bugs -> ot-mag.icmm.ru TCP D=4076 S=52661 Ack=2924641840 Seq=1209237004 Len=1368 Win=49248 Options=<nop,nop,tstamp 601952010 13829257>
________________________________
        bugs -> ot-mag.icmm.ru ETHER Type=0800 (IP), size = 1434 bytes
        bugs -> ot-mag.icmm.ru IP  D=195.69.157.34 S=195.69.156.67 LEN=1420, ID=60351, TOS=0x0, TTL=64
        bugs -> ot-mag.icmm.ru TCP D=4076 S=52661 Ack=2924641840 Seq=1209411756 Len=1368 Win=49248 Options=<nop,nop,tstamp 601952013 13829257>
________________________________
        bugs -> ot-mag.icmm.ru ETHER Type=0800 (IP), size = 1434 bytes
        bugs -> ot-mag.icmm.ru IP  D=195.69.157.34 S=195.69.156.67 LEN=1420, ID=60352, TOS=0x0, TTL=64
        bugs -> ot-mag.icmm.ru TCP D=4076 S=52661 Push Ack=2924641840 Seq=1209413124 Len=1368 Win=49248 Options=<nop,nop,tstamp 601952013 13829257>
________________________________
ot-mag.icmm.ru -> bugs         ETHER Type=0800 (IP), size = 66 bytes
ot-mag.icmm.ru -> bugs         IP  D=195.69.156.67 S=195.69.157.34 LEN=52, ID=55529, TOS=0x0, TTL=127
ot-mag.icmm.ru -> bugs         TCP D=52661 S=4076 Ack=1209384460 Seq=2924641840 Len=0 Win=32768 Options=<nop,nop,tstamp 13829257 601952013>
________________________________
        bugs -> ot-mag.icmm.ru ETHER Type=0800 (IP), size = 1434 bytes
        bugs -> ot-mag.icmm.ru IP  D=195.69.157.34 S=195.69.156.67 LEN=1420, ID=60353, TOS=0x0, TTL=64
        bugs -> ot-mag.icmm.ru TCP D=4076 S=52661 Ack=2924641840 Seq=1209414492 Len=1368 Win=49248 Options=<nop,nop,tstamp 601952014 13829257>
________________________________
        bugs -> ot-mag.icmm.ru ETHER Type=0800 (IP), size = 1434 bytes
        bugs -> ot-mag.icmm.ru IP  D=195.69.157.34 S=195.69.156.67 LEN=1420, ID=60354, TOS=0x0, TTL=64
        bugs -> ot-mag.icmm.ru TCP D=4076 S=52661 Push Ack=2924641840 Seq=1209415860 Len=1368 Win=49248 Options=<nop,nop,tstamp 601952014 13829257>
________________________________
ot-mag.icmm.ru -> bugs         ETHER Type=0800 (IP), size = 66 bytes
ot-mag.icmm.ru -> bugs         IP  D=195.69.156.67 S=195.69.157.34 LEN=52, ID=55530, TOS=0x0, TTL=127
ot-mag.icmm.ru -> bugs         TCP D=52661 S=4076 Ack=1209387196 Seq=2924641840 Len=0 Win=32768 Options=<nop,nop,tstamp 13829257 601952013>
________________________________
ot-mag.icmm.ru -> bugs         ETHER Type=0800 (IP), size = 66 bytes
ot-mag.icmm.ru -> bugs         IP  D=195.69.156.67 S=195.69.157.34 LEN=52, ID=55531, TOS=0x0, TTL=127
ot-mag.icmm.ru -> bugs         TCP D=52661 S=4076 Ack=1209388564 Seq=2924641840 Len=0 Win=31400 Options=<nop,nop,tstamp 13829257 601952013>
________________________________
ot-mag.icmm.ru -> bugs         ETHER Type=0800 (IP), size = 66 bytes
ot-mag.icmm.ru -> bugs         IP  D=195.69.156.67 S=195.69.157.34 LEN=52, ID=55532, TOS=0x0, TTL=127
ot-mag.icmm.ru -> bugs         TCP D=52661 S=4076 Ack=1209391300 Seq=2924641840 Len=0 Win=32768 Options=<nop,nop,tstamp 13829257 601952013>
________________________________
ot-mag.icmm.ru -> bugs         ETHER Type=0800 (IP), size = 66 bytes
ot-mag.icmm.ru -> bugs         IP  D=195.69.156.67 S=195.69.157.34 LEN=52, ID=55533, TOS=0x0, TTL=127
ot-mag.icmm.ru -> bugs         TCP D=52661 S=4076 Ack=1209394004 Seq=2924641840 Len=0 Win=32768 Options=<nop,nop,tstamp 13829257 601952013>
________________________________
ot-mag.icmm.ru -> bugs         ETHER Type=0800 (IP), size = 66 bytes
ot-mag.icmm.ru -> bugs         IP  D=195.69.156.67 S=195.69.157.34 LEN=52, ID=55534, TOS=0x0, TTL=127
ot-mag.icmm.ru -> bugs         TCP D=52661 S=4076 Ack=1209395372 Seq=2924641840 Len=0 Win=31400 Options=<nop,nop,tstamp 13829257 601952013>
________________________________
        bugs -> ot-mag.icmm.ru ETHER Type=0800 (IP), size = 1434 bytes
        bugs -> ot-mag.icmm.ru IP  D=195.69.157.34 S=195.69.156.67 LEN=1420, ID=60355, TOS=0x0, TTL=64
        bugs -> ot-mag.icmm.ru TCP D=4076 S=52661 Ack=2924641840 Seq=1209417228 Len=1368 Win=49248 Options=<nop,nop,tstamp 601952014 13829257>
________________________________
        bugs -> ot-mag.icmm.ru ETHER Type=0800 (IP), size = 1434 bytes
        bugs -> ot-mag.icmm.ru IP  D=195.69.157.34 S=195.69.156.67 LEN=1420, ID=60356, TOS=0x0, TTL=64
        bugs -> ot-mag.icmm.ru TCP D=4076 S=52661 Push Ack=2924641840 Seq=1209418596 Len=1368 Win=49248 Options=<nop,nop,tstamp 601952014 13829257>
________________________________
        bugs -> ot-mag.icmm.ru ETHER Type=0800 (IP), size = 1434 bytes
        bugs -> ot-mag.icmm.ru IP  D=195.69.157.34 S=195.69.156.67 LEN=1420, ID=60357, TOS=0x0, TTL=64
        bugs -> ot-mag.icmm.ru TCP D=4076 S=52661 Ack=2924641840 Seq=1209419964 Len=1368 Win=49248 Options=<nop,nop,tstamp 601952014 13829257>
________________________________
        bugs -> ot-mag.icmm.ru ETHER Type=0800 (IP), size = 1434 bytes
        bugs -> ot-mag.icmm.ru IP  D=195.69.157.34 S=195.69.156.67 LEN=1420, ID=60358, TOS=0x0, TTL=64
        bugs -> ot-mag.icmm.ru TCP D=4076 S=52661 Ack=2924641840 Seq=1209421332 Len=1368 Win=49248 Options=<nop,nop,tstamp 601952014 13829257>
________________________________
        bugs -> ot-mag.icmm.ru ETHER Type=0800 (IP), size = 1434 bytes
        bugs -> ot-mag.icmm.ru IP  D=195.69.157.34 S=195.69.156.67 LEN=1420, ID=60359, TOS=0x0, TTL=64
        bugs -> ot-mag.icmm.ru TCP D=4076 S=52661 Push Ack=2924641840 Seq=1209422700 Len=1368 Win=49248 Options=<nop,nop,tstamp 601952014 13829257>
________________________________
        bugs -> ot-mag.icmm.ru ETHER Type=0800 (IP), size = 1434 bytes
        bugs -> ot-mag.icmm.ru IP  D=195.69.157.34 S=195.69.156.67 LEN=1420, ID=60360, TOS=0x0, TTL=64
        bugs -> ot-mag.icmm.ru TCP D=4076 S=52661 Ack=2924641840 Seq=1209424068 Len=1368 Win=49248 Options=<nop,nop,tstamp 601952014 13829257>
________________________________
ot-mag.icmm.ru -> bugs         ETHER Type=0800 (IP), size = 66 bytes
ot-mag.icmm.ru -> bugs         IP  D=195.69.156.67 S=195.69.157.34 LEN=52, ID=55535, TOS=0x0, TTL=127
ot-mag.icmm.ru -> bugs         TCP D=52661 S=4076 Ack=1209398108 Seq=2924641840 Len=0 Win=32768 Options=<nop,nop,tstamp 13829257 601952013>
________________________________
ot-mag.icmm.ru -> bugs         ETHER Type=0800 (IP), size = 66 bytes
ot-mag.icmm.ru -> bugs         IP  D=195.69.156.67 S=195.69.157.34 LEN=52, ID=55536, TOS=0x0, TTL=127
ot-mag.icmm.ru -> bugs         TCP D=52661 S=4076 Ack=1209400844 Seq=2924641840 Len=0 Win=30032 Options=<nop,nop,tstamp 13829257 601952013>
________________________________
ot-mag.icmm.ru -> bugs         ETHER Type=0800 (IP), size = 66 bytes
ot-mag.icmm.ru -> bugs         IP  D=195.69.156.67 S=195.69.157.34 LEN=52, ID=55537, TOS=0x0, TTL=127
ot-mag.icmm.ru -> bugs         TCP D=52661 S=4076 Ack=1209403580 Seq=2924641840 Len=0 Win=27296 Options=<nop,nop,tstamp 13829257 601952013>
________________________________
ot-mag.icmm.ru -> bugs         ETHER Type=0800 (IP), size = 66 bytes
ot-mag.icmm.ru -> bugs         IP  D=195.69.156.67 S=195.69.157.34 LEN=52, ID=55538, TOS=0x0, TTL=127
ot-mag.icmm.ru -> bugs         TCP D=52661 S=4076 Ack=1209406316 Seq=2924641840 Len=0 Win=24560 Options=<nop,nop,tstamp 13829258 601952013>
________________________________
ot-mag.icmm.ru -> bugs         ETHER Type=0800 (IP), size = 66 bytes
ot-mag.icmm.ru -> bugs         IP  D=195.69.156.67 S=195.69.157.34 LEN=52, ID=55539, TOS=0x0, TTL=127
ot-mag.icmm.ru -> bugs         TCP D=52661 S=4076 Ack=1209409052 Seq=2924641840 Len=0 Win=21824 Options=<nop,nop,tstamp 13829258 601952013>
________________________________
ot-mag.icmm.ru -> bugs         ETHER Type=0800 (IP), size = 66 bytes
ot-mag.icmm.ru -> bugs         IP  D=195.69.156.67 S=195.69.157.34 LEN=52, ID=55540, TOS=0x0, TTL=127
ot-mag.icmm.ru -> bugs         TCP D=52661 S=4076 Ack=1209410388 Seq=2924641840 Len=0 Win=24224 Options=<nop,nop,tstamp 13829258 601952013>
________________________________
ot-mag.icmm.ru -> bugs         ETHER Type=0800 (IP), size = 66 bytes
ot-mag.icmm.ru -> bugs         IP  D=195.69.156.67 S=195.69.157.34 LEN=52, ID=55541, TOS=0x0, TTL=127
ot-mag.icmm.ru -> bugs         TCP D=52661 S=4076 Ack=1209410388 Seq=2924641840 Len=0 Win=32768 Options=<nop,nop,tstamp 13829258 601952013>
________________________________
ot-mag.icmm.ru -> bugs         ETHER Type=0800 (IP), size = 66 bytes
ot-mag.icmm.ru -> bugs         IP  D=195.69.156.67 S=195.69.157.34 LEN=52, ID=55542, TOS=0x0, TTL=127
ot-mag.icmm.ru -> bugs         TCP D=52661 S=4076 Ack=1209413124 Seq=2924641840 Len=0 Win=32768 Options=<nop,nop,tstamp 13829258 601952013>
________________________________
ot-mag.icmm.ru -> bugs         ETHER Type=0800 (IP), size = 66 bytes
ot-mag.icmm.ru -> bugs         IP  D=195.69.156.67 S=195.69.157.34 LEN=52, ID=55543, TOS=0x0, TTL=127
ot-mag.icmm.ru -> bugs         TCP D=52661 S=4076 Ack=1209414492 Seq=2924641840 Len=0 Win=31400 Options=<nop,nop,tstamp 13829258 601952013>
________________________________
ot-mag.icmm.ru -> bugs         ETHER Type=0800 (IP), size = 66 bytes
ot-mag.icmm.ru -> bugs         IP  D=195.69.156.67 S=195.69.157.34 LEN=52, ID=55544, TOS=0x0, TTL=127
ot-mag.icmm.ru -> bugs         TCP D=52661 S=4076 Ack=1209417228 Seq=2924641840 Len=0 Win=32768 Options=<nop,nop,tstamp 13829258 601952014>
________________________________
        bugs -> ot-mag.icmm.ru ETHER Type=0800 (IP), size = 1402 bytes
        bugs -> ot-mag.icmm.ru IP  D=195.69.157.34 S=195.69.156.67 LEN=1388, ID=60361, TOS=0x0, TTL=64
        bugs -> ot-mag.icmm.ru TCP D=4076 S=52661 Ack=2924641840 Seq=1209425436 Len=1336 Win=49248 Options=<nop,nop,tstamp 601952014 13829257>
________________________________
        bugs -> ot-mag.icmm.ru ETHER Type=0800 (IP), size = 1434 bytes
        bugs -> ot-mag.icmm.ru IP  D=195.69.157.34 S=195.69.156.67 LEN=1420, ID=60362, TOS=0x0, TTL=64
        bugs -> ot-mag.icmm.ru TCP D=4076 S=52661 Ack=2924641840 Seq=1209426772 Len=1368 Win=49248 Options=<nop,nop,tstamp 601952014 13829257>
________________________________
        bugs -> ot-mag.icmm.ru ETHER Type=0800 (IP), size = 1434 bytes
        bugs -> ot-mag.icmm.ru IP  D=195.69.157.34 S=195.69.156.67 LEN=1420, ID=60363, TOS=0x0, TTL=64
        bugs -> ot-mag.icmm.ru TCP D=4076 S=52661 Ack=2924641840 Seq=1209428140 Len=1368 Win=49248 Options=<nop,nop,tstamp 601952014 13829257>
________________________________
        bugs -> ot-mag.icmm.ru ETHER Type=0800 (IP), size = 1434 bytes
        bugs -> ot-mag.icmm.ru IP  D=195.69.157.34 S=195.69.156.67 LEN=1420, ID=60364, TOS=0x0, TTL=64
        bugs -> ot-mag.icmm.ru TCP D=4076 S=52661 Push Ack=2924641840 Seq=1209429508 Len=1368 Win=49248 Options=<nop,nop,tstamp 601952014 13829257>
________________________________
        bugs -> ot-mag.icmm.ru ETHER Type=0800 (IP), size = 1434 bytes
        bugs -> ot-mag.icmm.ru IP  D=195.69.157.34 S=195.69.156.67 LEN=1420, ID=60365, TOS=0x0, TTL=64
        bugs -> ot-mag.icmm.ru TCP D=4076 S=52661 Ack=2924641840 Seq=1209430876 Len=1368 Win=49248 Options=<nop,nop,tstamp 601952014 13829258>
________________________________
        bugs -> ot-mag.icmm.ru ETHER Type=0800 (IP), size = 1434 bytes
        bugs -> ot-mag.icmm.ru IP  D=195.69.157.34 S=195.69.156.67 LEN=1420, ID=60366, TOS=0x0, TTL=64
        bugs -> ot-mag.icmm.ru TCP D=4076 S=52661 Ack=2924641840 Seq=1209432244 Len=1368 Win=49248 Options=<nop,nop,tstamp 601952014 13829258>
________________________________
        bugs -> ot-mag.icmm.ru ETHER Type=0800 (IP), size = 1434 bytes
        bugs -> ot-mag.icmm.ru IP  D=195.69.157.34 S=195.69.156.67 LEN=1420, ID=60367, TOS=0x0, TTL=64
        bugs -> ot-mag.icmm.ru TCP D=4076 S=52661 Ack=2924641840 Seq=1209433612 Len=1368 Win=49248 Options=<nop,nop,tstamp 601952014 13829258>
________________________________
        bugs -> ot-mag.icmm.ru ETHER Type=0800 (IP), size = 1434 bytes
        bugs -> ot-mag.icmm.ru IP  D=195.69.157.34 S=195.69.156.67 LEN=1420, ID=60368, TOS=0x0, TTL=64
        bugs -> ot-mag.icmm.ru TCP D=4076 S=52661 Ack=2924641840 Seq=1209434980 Len=1368 Win=49248 Options=<nop,nop,tstamp 601952014 13829258>
________________________________
        bugs -> ot-mag.icmm.ru ETHER Type=0800 (IP), size = 1434 bytes
        bugs -> ot-mag.icmm.ru IP  D=195.69.157.34 S=195.69.156.67 LEN=1420, ID=60369, TOS=0x0, TTL=64
        bugs -> ot-mag.icmm.ru TCP D=4076 S=52661 Ack=2924641840 Seq=1209436348 Len=1368 Win=49248 Options=<nop,nop,tstamp 601952014 13829258>
________________________________
        bugs -> ot-mag.icmm.ru ETHER Type=0800 (IP), size = 1434 bytes
        bugs -> ot-mag.icmm.ru IP  D=195.69.157.34 S=195.69.156.67 LEN=1420, ID=60370, TOS=0x0, TTL=64
        bugs -> ot-mag.icmm.ru TCP D=4076 S=52661 Ack=2924641840 Seq=1209437716 Len=1368 Win=49248 Options=<nop,nop,tstamp 601952014 13829258>
________________________________
        bugs -> ot-mag.icmm.ru ETHER Type=0800 (IP), size = 1434 bytes
        bugs -> ot-mag.icmm.ru IP  D=195.69.157.34 S=195.69.156.67 LEN=1420, ID=60371, TOS=0x0, TTL=64
        bugs -> ot-mag.icmm.ru TCP D=4076 S=52661 Ack=2924641840 Seq=1209439084 Len=1368 Win=49248 Options=<nop,nop,tstamp 601952014 13829258>
________________________________
        bugs -> ot-mag.icmm.ru ETHER Type=0800 (IP), size = 1434 bytes
        bugs -> ot-mag.icmm.ru IP  D=195.69.157.34 S=195.69.156.67 LEN=1420, ID=60372, TOS=0x0, TTL=64
        bugs -> ot-mag.icmm.ru TCP D=4076 S=52661 Ack=2924641840 Seq=1209440452 Len=1368 Win=49248 Options=<nop,nop,tstamp 601952014 13829258>
________________________________
        bugs -> ot-mag.icmm.ru ETHER Type=0800 (IP), size = 1402 bytes
        bugs -> ot-mag.icmm.ru IP  D=195.69.157.34 S=195.69.156.67 LEN=1388, ID=60373, TOS=0x0, TTL=64
        bugs -> ot-mag.icmm.ru TCP D=4076 S=52661 Ack=2924641840 Seq=1209441820 Len=1336 Win=49248 Options=<nop,nop,tstamp 601952014 13829258>
________________________________
        bugs -> ot-mag.icmm.ru ETHER Type=0800 (IP), size = 1434 bytes
        bugs -> ot-mag.icmm.ru IP  D=195.69.157.34 S=195.69.156.67 LEN=1420, ID=60374, TOS=0x0, TTL=64
        bugs -> ot-mag.icmm.ru TCP D=4076 S=52661 Ack=2924641840 Seq=1209443156 Len=1368 Win=49248 Options=<nop,nop,tstamp 601952014 13829258>
________________________________
        bugs -> ot-mag.icmm.ru ETHER Type=0800 (IP), size = 1434 bytes
        bugs -> ot-mag.icmm.ru IP  D=195.69.157.34 S=195.69.156.67 LEN=1420, ID=60375, TOS=0x0, TTL=64
        bugs -> ot-mag.icmm.ru TCP D=4076 S=52661 Push Ack=2924641840 Seq=1209444524 Len=1368 Win=49248 Options=<nop,nop,tstamp 601952014 13829258>
________________________________
        bugs -> ot-mag.icmm.ru ETHER Type=0800 (IP), size = 1434 bytes
        bugs -> ot-mag.icmm.ru IP  D=195.69.157.34 S=195.69.156.67 LEN=1420, ID=60376, TOS=0x0, TTL=64
        bugs -> ot-mag.icmm.ru TCP D=4076 S=52661 Ack=2924641840 Seq=1209445892 Len=1368 Win=49248 Options=<nop,nop,tstamp 601952014 13829258>
________________________________
        bugs -> ot-mag.icmm.ru ETHER Type=0800 (IP), size = 1434 bytes
        bugs -> ot-mag.icmm.ru IP  D=195.69.157.34 S=195.69.156.67 LEN=1420, ID=60377, TOS=0x0, TTL=64
        bugs -> ot-mag.icmm.ru TCP D=4076 S=52661 Ack=2924641840 Seq=1209447260 Len=1368 Win=49248 Options=<nop,nop,tstamp 601952014 13829258>
________________________________
        bugs -> ot-mag.icmm.ru ETHER Type=0800 (IP), size = 1434 bytes
        bugs -> ot-mag.icmm.ru IP  D=195.69.157.34 S=195.69.156.67 LEN=1420, ID=60378, TOS=0x0, TTL=64
        bugs -> ot-mag.icmm.ru TCP D=4076 S=52661 Push Ack=2924641840 Seq=1209448628 Len=1368 Win=49248 Options=<nop,nop,tstamp 601952014 13829258>
________________________________
ot-mag.icmm.ru -> bugs         ETHER Type=0800 (IP), size = 66 bytes
ot-mag.icmm.ru -> bugs         IP  D=195.69.156.67 S=195.69.157.34 LEN=52, ID=55545, TOS=0x0, TTL=127
ot-mag.icmm.ru -> bugs         TCP D=52661 S=4076 Ack=1209419964 Seq=2924641840 Len=0 Win=32768 Options=<nop,nop,tstamp 13829258 601952014>
________________________________
        bugs -> ot-mag.icmm.ru ETHER Type=0800 (IP), size = 1434 bytes
        bugs -> ot-mag.icmm.ru IP  D=195.69.157.34 S=195.69.156.67 LEN=1420, ID=60379, TOS=0x0, TTL=64
        bugs -> ot-mag.icmm.ru TCP D=4076 S=52661 Ack=2924641840 Seq=1209449996 Len=1368 Win=49248 Options=<nop,nop,tstamp 601952014 13829258>
________________________________
        bugs -> ot-mag.icmm.ru ETHER Type=0800 (IP), size = 1434 bytes
        bugs -> ot-mag.icmm.ru IP  D=195.69.157.34 S=195.69.156.67 LEN=1420, ID=60380, TOS=0x0, TTL=64
        bugs -> ot-mag.icmm.ru TCP D=4076 S=52661 Push Ack=2924641840 Seq=1209451364 Len=1368 Win=49248 Options=<nop,nop,tstamp 601952014 13829258>
________________________________
ot-mag.icmm.ru -> bugs         ETHER Type=0800 (IP), size = 66 bytes
ot-mag.icmm.ru -> bugs         IP  D=195.69.156.67 S=195.69.157.34 LEN=52, ID=55546, TOS=0x0, TTL=127
ot-mag.icmm.ru -> bugs         TCP D=52661 S=4076 Ack=1209422700 Seq=2924641840 Len=0 Win=32768 Options=<nop,nop,tstamp 13829258 601952014>
________________________________
ot-mag.icmm.ru -> bugs         ETHER Type=0800 (IP), size = 66 bytes
ot-mag.icmm.ru -> bugs         IP  D=195.69.156.67 S=195.69.157.34 LEN=52, ID=55547, TOS=0x0, TTL=127
ot-mag.icmm.ru -> bugs         TCP D=52661 S=4076 Ack=1209424068 Seq=2924641840 Len=0 Win=31400 Options=<nop,nop,tstamp 13829258 601952014>
________________________________
        bugs -> ot-mag.icmm.ru ETHER Type=0800 (IP), size = 1434 bytes
        bugs -> ot-mag.icmm.ru IP  D=195.69.157.34 S=195.69.156.67 LEN=1420, ID=60381, TOS=0x0, TTL=64
        bugs -> ot-mag.icmm.ru TCP D=4076 S=52661 Ack=2924641840 Seq=1209452732 Len=1368 Win=49248 Options=<nop,nop,tstamp 601952014 13829258>
________________________________
        bugs -> ot-mag.icmm.ru ETHER Type=0800 (IP), size = 1434 bytes
        bugs -> ot-mag.icmm.ru IP  D=195.69.157.34 S=195.69.156.67 LEN=1420, ID=60382, TOS=0x0, TTL=64
        bugs -> ot-mag.icmm.ru TCP D=4076 S=52661 Push Ack=2924641840 Seq=1209454100 Len=1368 Win=49248 Options=<nop,nop,tstamp 601952014 13829258>
________________________________
ot-mag.icmm.ru -> bugs         ETHER Type=0800 (IP), size = 66 bytes
ot-mag.icmm.ru -> bugs         IP  D=195.69.156.67 S=195.69.157.34 LEN=52, ID=55548, TOS=0x0, TTL=127
ot-mag.icmm.ru -> bugs         TCP D=52661 S=4076 Ack=1209426772 Seq=2924641840 Len=0 Win=32768 Options=<nop,nop,tstamp 13829258 601952014>
________________________________
        bugs -> ot-mag.icmm.ru ETHER Type=0800 (IP), size = 1434 bytes
        bugs -> ot-mag.icmm.ru IP  D=195.69.157.34 S=195.69.156.67 LEN=1420, ID=60383, TOS=0x0, TTL=64
        bugs -> ot-mag.icmm.ru TCP D=4076 S=52661 Ack=2924641840 Seq=1209455468 Len=1368 Win=49248 Options=<nop,nop,tstamp 601952014 13829258>
________________________________
        bugs -> ot-mag.icmm.ru ETHER Type=0800 (IP), size = 1434 bytes
        bugs -> ot-mag.icmm.ru IP  D=195.69.157.34 S=195.69.156.67 LEN=1420, ID=60384, TOS=0x0, TTL=64
        bugs -> ot-mag.icmm.ru TCP D=4076 S=52661 Ack=2924641840 Seq=1209456836 Len=1368 Win=49248 Options=<nop,nop,tstamp 601952014 13829258>
________________________________
ot-mag.icmm.ru -> bugs         ETHER Type=0800 (IP), size = 66 bytes
ot-mag.icmm.ru -> bugs         IP  D=195.69.156.67 S=195.69.157.34 LEN=52, ID=55549, TOS=0x0, TTL=127
ot-mag.icmm.ru -> bugs         TCP D=52661 S=4076 Ack=1209429508 Seq=2924641840 Len=0 Win=32768 Options=<nop,nop,tstamp 13829258 601952014>
________________________________
        bugs -> ot-mag.icmm.ru ETHER Type=0800 (IP), size = 1402 bytes
        bugs -> ot-mag.icmm.ru IP  D=195.69.157.34 S=195.69.156.67 LEN=1388, ID=60385, TOS=0x0, TTL=64
        bugs -> ot-mag.icmm.ru TCP D=4076 S=52661 Ack=2924641840 Seq=1209458204 Len=1336 Win=49248 Options=<nop,nop,tstamp 601952014 13829258>
________________________________
        bugs -> ot-mag.icmm.ru ETHER Type=0800 (IP), size = 1434 bytes
        bugs -> ot-mag.icmm.ru IP  D=195.69.157.34 S=195.69.156.67 LEN=1420, ID=60386, TOS=0x0, TTL=64
        bugs -> ot-mag.icmm.ru TCP D=4076 S=52661 Ack=2924641840 Seq=1209459540 Len=1368 Win=49248 Options=<nop,nop,tstamp 601952014 13829258>
________________________________
        bugs -> ot-mag.icmm.ru ETHER Type=0800 (IP), size = 1434 bytes
        bugs -> ot-mag.icmm.ru IP  D=195.69.157.34 S=195.69.156.67 LEN=1420, ID=60387, TOS=0x0, TTL=64
        bugs -> ot-mag.icmm.ru TCP D=4076 S=52661 Push Ack=2924641840 Seq=1209460908 Len=1368 Win=49248 Options=<nop,nop,tstamp 601952014 13829258>
________________________________
ot-mag.icmm.ru -> bugs         ETHER Type=0800 (IP), size = 66 bytes
ot-mag.icmm.ru -> bugs         IP  D=195.69.156.67 S=195.69.157.34 LEN=52, ID=55550, TOS=0x0, TTL=127
ot-mag.icmm.ru -> bugs         TCP D=52661 S=4076 Ack=1209432244 Seq=2924641840 Len=0 Win=32768 Options=<nop,nop,tstamp 13829258 601952014>
________________________________
ot-mag.icmm.ru -> bugs         ETHER Type=0800 (IP), size = 66 bytes
ot-mag.icmm.ru -> bugs         IP  D=195.69.156.67 S=195.69.157.34 LEN=52, ID=55551, TOS=0x0, TTL=127
ot-mag.icmm.ru -> bugs         TCP D=52661 S=4076 Ack=1209434980 Seq=2924641840 Len=0 Win=32768 Options=<nop,nop,tstamp 13829258 601952014>
________________________________
ot-mag.icmm.ru -> bugs         ETHER Type=0800 (IP), size = 66 bytes
ot-mag.icmm.ru -> bugs         IP  D=195.69.156.67 S=195.69.157.34 LEN=52, ID=55552, TOS=0x0, TTL=127
ot-mag.icmm.ru -> bugs         TCP D=52661 S=4076 Ack=1209437716 Seq=2924641840 Len=0 Win=32768 Options=<nop,nop,tstamp 13829258 601952014>
________________________________
        bugs -> ot-mag.icmm.ru ETHER Type=0800 (IP), size = 1434 bytes
        bugs -> ot-mag.icmm.ru IP  D=195.69.157.34 S=195.69.156.67 LEN=1420, ID=60388, TOS=0x0, TTL=64
        bugs -> ot-mag.icmm.ru TCP D=4076 S=52661 Ack=2924641840 Seq=1209462276 Len=1368 Win=49248 Options=<nop,nop,tstamp 601952015 13829258>
________________________________
        bugs -> ot-mag.icmm.ru ETHER Type=0800 (IP), size = 1434 bytes
        bugs -> ot-mag.icmm.ru IP  D=195.69.157.34 S=195.69.156.67 LEN=1420, ID=60389, TOS=0x0, TTL=64
        bugs -> ot-mag.icmm.ru TCP D=4076 S=52661 Push Ack=2924641840 Seq=1209463644 Len=1368 Win=49248 Options=<nop,nop,tstamp 601952015 13829258>
________________________________
        bugs -> ot-mag.icmm.ru ETHER Type=0800 (IP), size = 1434 bytes
        bugs -> ot-mag.icmm.ru IP  D=195.69.157.34 S=195.69.156.67 LEN=1420, ID=60390, TOS=0x0, TTL=64
        bugs -> ot-mag.icmm.ru TCP D=4076 S=52661 Ack=2924641840 Seq=1209465012 Len=1368 Win=49248 Options=<nop,nop,tstamp 601952015 13829258>
________________________________
        bugs -> ot-mag.icmm.ru ETHER Type=0800 (IP), size = 1434 bytes
        bugs -> ot-mag.icmm.ru IP  D=195.69.157.34 S=195.69.156.67 LEN=1420, ID=60391, TOS=0x0, TTL=64
        bugs -> ot-mag.icmm.ru TCP D=4076 S=52661 Push Ack=2924641840 Seq=1209466380 Len=1368 Win=49248 Options=<nop,nop,tstamp 601952015 13829258>
________________________________
        bugs -> ot-mag.icmm.ru ETHER Type=0800 (IP), size = 1434 bytes
        bugs -> ot-mag.icmm.ru IP  D=195.69.157.34 S=195.69.156.67 LEN=1420, ID=60392, TOS=0x0, TTL=64
        bugs -> ot-mag.icmm.ru TCP D=4076 S=52661 Ack=2924641840 Seq=1209467748 Len=1368 Win=49248 Options=<nop,nop,tstamp 601952015 13829258>
________________________________
        bugs -> ot-mag.icmm.ru ETHER Type=0800 (IP), size = 1434 bytes
        bugs -> ot-mag.icmm.ru IP  D=195.69.157.34 S=195.69.156.67 LEN=1420, ID=60393, TOS=0x0, TTL=64
        bugs -> ot-mag.icmm.ru TCP D=4076 S=52661 Push Ack=2924641840 Seq=1209469116 Len=1368 Win=49248 Options=<nop,nop,tstamp 601952015 13829258>
________________________________
ot-mag.icmm.ru -> bugs         ETHER Type=0800 (IP), size = 66 bytes
ot-mag.icmm.ru -> bugs         IP  D=195.69.156.67 S=195.69.157.34 LEN=52, ID=55553, TOS=0x0, TTL=127
ot-mag.icmm.ru -> bugs         TCP D=52661 S=4076 Ack=1209440452 Seq=2924641840 Len=0 Win=32768 Options=<nop,nop,tstamp 13829258 601952014>
________________________________
ot-mag.icmm.ru -> bugs         ETHER Type=0800 (IP), size = 66 bytes
ot-mag.icmm.ru -> bugs         IP  D=195.69.156.67 S=195.69.157.34 LEN=52, ID=55554, TOS=0x0, TTL=127
ot-mag.icmm.ru -> bugs         TCP D=52661 S=4076 Ack=1209443156 Seq=2924641840 Len=0 Win=32768 Options=<nop,nop,tstamp 13829258 601952014>
________________________________
ot-mag.icmm.ru -> bugs         ETHER Type=0800 (IP), size = 66 bytes
ot-mag.icmm.ru -> bugs         IP  D=195.69.156.67 S=195.69.157.34 LEN=52, ID=55555, TOS=0x0, TTL=127
ot-mag.icmm.ru -> bugs         TCP D=52661 S=4076 Ack=1209445892 Seq=2924641840 Len=0 Win=32768 Options=<nop,nop,tstamp 13829258 601952014>
________________________________
        bugs -> ot-mag.icmm.ru ETHER Type=0800 (IP), size = 1434 bytes
        bugs -> ot-mag.icmm.ru IP  D=195.69.157.34 S=195.69.156.67 LEN=1420, ID=60564, TOS=0x0, TTL=64
        bugs -> ot-mag.icmm.ru TCP D=4076 S=52661 Ack=2924641840 Seq=1209702596 Len=1368 Win=49248 Options=<nop,nop,tstamp 601952019 13829258>
________________________________
ot-mag.icmm.ru -> bugs         ETHER Type=0800 (IP), size = 66 bytes
ot-mag.icmm.ru -> bugs         IP  D=195.69.156.67 S=195.69.157.34 LEN=52, ID=55651, TOS=0x0, TTL=127
ot-mag.icmm.ru -> bugs         TCP D=52661 S=4076 Ack=1209675268 Seq=2924641840 Len=0 Win=32768 Options=<nop,nop,tstamp 13829258 601952019>
________________________________
        bugs -> ot-mag.icmm.ru ETHER Type=0800 (IP), size = 1402 bytes
